Question_number;Question;NumCorrect;Answer1;Answer2;Answer3;Answer4;Answer5;Answer6;Correct;Explanation
85;You are a head of BI at a large enterprise company with multiple business units that each have different priorities and budgets. You use on-demand pricing for BigQuery with a quota of 2K concurrent on-demand slots per project. Users at your organization sometimes don't get slots to execute their query and you need to correct this. You'd like to avoid introducing new projects to your account. What should you do?;1;Convert your batch BQ queries into interactive BQ queries.;Create an additional project to overcome the 2K on-demand per-project quota.;Switch to flat-rate pricing and establish a hierarchical priority model for your projects.;Increase the amount of concurrent slots per project at the Quotas page at the Cloud Console.;;;Switch to flat-rate pricing and establish a hierarchical priority model for your projects.;When using on-demand pricing, you pay for the amount of data processed by each query. However, BigQuery enforces a concurrent rate limit and a daily limit on the amount of query data, which may restrict the resources for executing queries. Switching to flat-rate pricing allows you to run a virtually unlimited number of queries while only paying for the resources reserved for your project, not by the amount of data processed by each query. The introduction of a hierarchical priority model will ensure that the available resources are allocated according to the priorities of different projects, reducing the chance that users won't get slots to execute their query
86;You have an Apache Kafka cluster on-prem with topics containing web application logs. You need to replicate the data to Google Cloud for analysis in BigQuery and Cloud Storage. The preferred replication method is mirroring to avoid deployment of Kafka Connect plugins. What should you do?;1;Deploy a Kafka cluster on GCE VM Instances. Configure your on-prem cluster to mirror your topics to the cluster running in GCE. Use a Dataproc cluster or Dataflow job to read from Kafka and write to GCS.;Deploy a Kafka cluster on GCE VM Instances with the Pub/Sub Kafka connector configured as a Sink connector. Use a Dataproc cluster or Dataflow job to read from Kafka and write to GCS.;Deploy the Pub/Sub Kafka connector to your on-prem Kafka cluster and configure Pub/Sub as a Source connector. Use a Dataflow job to read from Pub/Sub and write to GCS.;Deploy the Pub/Sub Kafka connector to your on-prem Kafka cluster and configure Pub/Sub as a Sink connector. Use a Dataflow job to read from Pub/Sub and write to GCS.;;;Deploy a Kafka cluster on GCE VM Instances. Configure your on-prem cluster to mirror your topics to the cluster running in GCE. Use a Dataproc cluster or Dataflow job to read from Kafka and write to GCS.;This approach avoids the use of Kafka Connect plugins (as per the requirement). The on-premises Kafka cluster is mirrored to a Kafka cluster running on Google Compute Engine (GCE) VM instances. Data can then be read from this GCE Kafka cluster using either a Dataproc cluster or a Dataflow job, and then written to Google Cloud Storage (GCS) for analysis in BigQuery.
87;You've migrated a Hadoop job from an on-prem cluster to dataproc and GCS. Your Spark job is a complicated analytical workload that consists of many shuffling operations and initial data are parquet files (on average 200-400 MB size each). You see some degradation in performance after the migration to Dataproc, so you'd like to optimize for it. You need to keep in mind that your organization is very cost-sensitive, so you'd like to continue using Dataproc on preemptibles (with 2 non-preemptible workers only) for this workload. What should you do?;1;Increase the size of your parquet files to ensure them to be 1 GB minimum.;Switch to TFRecords formats (appr. 200MB per file) instead of parquet files.;Switch from HDDs to SSDs, copy initial data from GCS to HDFS, run the Spark job and copy results back to GCS.;Switch from HDDs to SSDs, override the preemptible VMs configuration to increase the boot disk size.;;;Switch from HDDs to SSDs, override the preemptible VMs configuration to increase the boot disk size.;Since the workload involves many shuffle operations, it is important to ensure that the disk performance is optimized. SSDs offer faster read and write speeds compared to HDDs, which can help to improve the performance of shuffle operations. Moreover, increasing the boot disk size can help to provide more space for the local storage of shuffle data, thus reducing the risk of running out of disk space during shuffle operations. This can be especially helpful when using preemptible VMs, which often have lower resources than standard VMs.
88;Your team is responsible for developing and maintaining ETLs in your company. One of your Dataflow jobs is failing because of some errors in the input data, and you need to improve reliability of the pipeline (incl. being able to reprocess all failing data). What should you do?;1;Add a filtering step to skip these types of errors in the future, extract erroneous rows from logs.;Add a try catch block to your DoFn that transforms the data, extract erroneous rows from logs.;Add a try catch block to your DoFn that transforms the data, write erroneous rows to Pub/Sub PubSub directly from the DoFn.;Add a try catch block to your DoFn that transforms the data, use a sideOutput to create a PCollection that can be stored to Pub/Sub later.;;;Add a try catch block to your DoFn that transforms the data, use a sideOutput to create a PCollection that can be stored to Pub/Sub later.;In Apache Beam (and hence in Dataflow), side outputs can be used to output to multiple PCollections from a single PTransform. This approach allows you to handle errors in a fine-grained way without stopping your entire pipeline. You can use side outputs to capture the error records and store them separately for future processing. In this case, you can add a try-catch block to handle errors, and use a sideOutput to capture erroneous records. These records can be written to Pub/Sub later for reprocessing or analysis.
89;You're training a model to predict housing prices based on an available dataset with real estate properties. Your plan is to train a fully connected neural net, and you've discovered that the dataset contains latitude and longitude of the property. Real estate professionals have told you that the location of the property is highly influential on price, so you'd like to engineer a feature that incorporates this physical dependency. What should you do?;1;Provide latitude and longitude as input vectors to your neural net.;Create a numeric column from a feature cross of latitude and longitude.;Create a feature cross of latitude and longitude, bucketize it at the minute level and use L1 regularization during optimization.;Create a feature cross of latitude and longitude, bucketize it at the minute level and use L2 regularization during optimization.;;;Create a numeric column from a feature cross of latitude and longitude.;Creating a feature cross of two or more features can capture more complex relationships in the data. This is especially true for geographical data, where the interaction of latitude and longitude can represent a specific location on earth. You can create a numeric column from this feature cross to feed into your neural network. While L1 and L2 regularization can help prevent overfitting, they are not directly related to the task of creating and using a feature cross of latitude and longitude.<br>While L1 and L2 regularization can help prevent overfitting, they are not directly related to the task of creating and using a feature cross of latitude and longitude.
90;You are deploying MariaDB SQL databases on GCE VM Instances and need to configure monitoring and alerting. You want to collect metrics including network connections, disk IO and replication status from MariaDB with minimal development effort and use StackDriver for dashboards and alerts. What should you do?;1;Install the OpenCensus Agent and create a custom metric collection application with a StackDriver exporter.;Place the MariaDB instances in an Instance Group with a Health Check.;Install the StackDriver Logging Agent and configure fluentd in_tail plugin to read MariaDB logs.;Install the StackDriver Agent and configure the MySQL plugin.;;;Install the StackDriver Agent and configure the MySQL plugin.;Stackdriver Agent supports the collection of system and application metrics from your VM instances. For databases like MariaDB and MySQL, it has a built-in MySQL plugin, which can be used to collect and send various metrics to Stackdriver, like disk IO, network connections, and replication status. This solution requires minimal development effort and can be easily integrated with Stackdriver for monitoring, alerting, and dashboards.
91;You work for a bank. You have a labelled dataset that contains information on already granted loan application and whether these applications have been defaulted. You have been asked to train a model to predict default rates for credit applicants. What should you do?;1;Increase the size of the dataset by collecting additional data.;Train a linear regression to predict a credit default risk score.;Remove the bias from the data and collect applications that have been declined loans.;Match loan applicants with their social profiles to enable feature engineering.;;;Train a linear regression to predict a credit default risk score.;In this context, we already have a labeled dataset that marks whether loan applications defaulted. This is a classic use case for supervised learning where we have input data (loan application details) and output data (default or not). A linear regression model could be used to predict a continuous value (the credit default risk score), which can be thresholded to make a binary classification (likely to default or not).
92;You need to migrate a 2TB relational database to Google Cloud Platform. You do not have the resources to significantly refactor the application that uses this database and cost to operate is of primary concern. Which service do you select for storing and serving your data?;1;Cloud Spanner;Cloud Bigtable;Cloud Firestore;Cloud SQL;;;Cloud SQL;Cloud SQL is a fully-managed relational database service that can handle MySQL, PostgreSQL, and SQL Server. It is an ideal choice for migrating a 2TB relational database without significant refactoring, as it provides a familiar SQL interface and support for existing tools and libraries. While Cloud Spanner can also handle relational data and provide stronger consistency guarantees at global scale, it may be overkill for many applications and can be more expensive than Cloud SQL. Cloud Bigtable and Firestore are both NoSQL databases and would likely require significant application refactoring
93;You're using Bigtable for a real-time application, and you have a heavy load that is a mix of read and writes. You've recently identified an additional use case and need to perform hourly an analytical job to calculate certain statistics across the whole database. You need to ensure both the reliability of your production application as well as the analytical workload.;1;Export Bigtable dump to GCS and run your analytical job on top of the exported files.;Add a second cluster to an existing instance with a multi-cluster routing, use live-traffic app profile for your regular workload and batch-analytics profile for the analytics workload.;Add a second cluster to an existing instance with a single-cluster routing, use live-traffic app profile for your regular workload and batch-analytics profile for the analytics workload.;Increase the size of your existing cluster twice and execute your analytics workload on your new resized cluster.;;;Add a second cluster to an existing instance with a multi-cluster routing, use live-traffic app profile for your regular workload and batch-analytics profile for the analytics workload.;Adding a second cluster to the existing instance with multi-cluster routing can effectively handle the mix of real-time and analytical workload. With multi-cluster routing, you can create different application profiles (like live-traffic and batch-analytics in this case) that route data to different clusters based on your workload needs. This approach avoids overloading a single cluster with all types of workloads, ensuring better reliability and performance. The other options are less suitable or more complex for this specific scenario
94;You are designing an Apache Beam pipeline to enrich data from Cloud Pub/Sub with static reference data from BigQuery. The reference data is small enough to fit in memory on a single worker. The pipeline should write enriched results to BigQuery for analysis. Which job type and transforms should this pipeline use?;1;Batch job, PubSubIO, side-inputs;Streaming job, PubSubIO, JdbcIO, side-outputs;Streaming job, PubSubIO, BigQueryIO, side-inputs;Streaming job, PubSubIO, BigQueryIO, side-outputs;;;Streaming job, PubSubIO, BigQueryIO, side-inputs;You're ingesting data from Cloud Pub/Sub, which is a real-time messaging service, so you need a streaming job. PubSubIO is used to read data from Cloud Pub/Sub. Since the reference data from BigQuery is small enough to fit into memory on a single worker, it can be loaded into memory as a side input. Finally, you can use BigQueryIO to write the enriched data back to BigQuery for analysis. The other options are incorrect because they involve either the wrong job type or the wrong I/O operations.
95;You have a data pipeline that writes data to Cloud Bigtable using well-designed row keys. You want to monitor your pipeline to determine when to increase the size of your Cloud Bigtable cluster. Which two actions can you take to accomplish this? (Choose two.);2;Review Key Visualizer metrics. Increase the size of the Cloud Bigtable cluster when the Read pressure index is above 100.;Review Key Visualizer metrics. Increase the size of the Cloud Bigtable cluster when the Write pressure index is above 100.;Monitor the latency of write operations. Increase the size of the Cloud Bigtable cluster when there is a sustained increase in write latency.;Monitor storage utilization. Increase the size of the Cloud Bigtable cluster when utilization increases above 70% of max capacity.;Monitor latency of read operations. Increase the size of the Cloud Bigtable cluster of read operations take longer than 100 ms.;;Monitor storage utilization. Increase the size of the Cloud Bigtable cluster when utilization increases above 70% of max capacity.|Monitor the latency of write operations. Increase the size of the Cloud Bigtable cluster when there is a sustained increase in write latency.;Review Key Visualizer metrics and monitor latency of write operations. When the Write pressure index exceeds 100 or when there is a sustained increase in write latency, it could indicate that your cluster does not have enough resources to handle the workload. In such cases, increasing the size of your cluster could help.
96;You want to analyze hundreds of thousands of social media posts daily at the lowest cost and with the fewest steps. You have the following requirements:<br> <BR> You will batch-load the posts once per day and run them through the Cloud Natural Language API. <BR> You will extract topics and sentiment from the posts. <BR> You must store the raw posts for archiving and reprocessing. <BR> You will create dashboards to be shared with people both inside and outside your organization. You need to store both the data extracted from the API to perform analysis as well as the raw social media posts for historical archiving. What should you do?;1;Store the social media posts and the data extracted from the API in BigQuery.;Store the social media posts and the data extracted from the API in Cloud SQL.;Store the raw social media posts in Cloud Storage, and write the data extracted from the API into BigQuery.;Feed to social media posts into the API directly from the source, and write the extracted data from the API into BigQuery.;;;Store the raw social media posts in Cloud Storage, and write the data extracted from the API into BigQuery.;Google Cloud Storage is a cost-effective solution for storing large amounts of raw data, such as social media posts, for archiving purposes. On the other hand, BigQuery is designed for running fast, SQL-like queries against large datasets, so it's a good fit for storing the processed data that will be used for analysis. Thus, storing the raw posts in Cloud Storage and the extracted data in BigQuery will meet all the requirements, including cost-effectiveness and ease of analysis.
97;You store historic data in Cloud Storage. You need to perform analytics on the historic data. You want to use a solution to detect invalid data entries and perform data transformations that will not require programming or knowledge of SQL. What should you do?;1;Use Cloud Dataflow with Beam to detect errors and perform transformations.;Use Cloud Dataprep with recipes to detect errors and perform transformations.;Use Cloud Dataproc with a Hadoop job to detect errors and perform transformations.;Use federated tables in BigQuery with queries to detect errors and perform transformations.;;;Use Cloud Dataprep with recipes to detect errors and perform transformations.;Google Cloud Dataprep is an intelligent data service for visually exploring, cleaning, and preparing data for analysis. It is a serverless, no-code data preparation tool that is used to clean and transform data for analysis without the need for programming or SQL knowledge. It uses recipes, which are sets of steps to transform your data.
98;Your company needs to upload their historic data to Cloud Storage. The security rules don't allow access from external IPs to their on-premises resources. After an initial upload, they will add new data from existing on-premises applications every day. What should they do?;1;Execute gsutil rsync from the on-premises servers.;Use Dataflow and write the data to Cloud Storage.;Write a job template in Dataproc to perform the data transfer.;Install an FTP server on a Compute Engine VM to receive the files and move them to Cloud Storage.;;;Execute gsutil rsync from the on-premises servers.;gsutil is a Python application that lets you access Cloud Storage from the command line. The gsutil rsync command allows you to synchronize content of the source directory and the destination directory. Since this can be executed from the on-premise servers, it will not require access from external IPs to their on-premises resources.
99;"You have a query that filters a BigQuery table using a WHERE clause on timestamp and ID columns. By using bq query `""-dry_run you learn that the query triggers a full scan of the table, even though the filter on timestamp and ID select a tiny fraction of the overall data. You want to reduce the amount of data scanned by BigQuery with minimal changes to existing SQL queries. What should you do?";1;Create a separate table for each ID.;Use the LIMIT keyword to reduce the number of rows returned.;Recreate the table with a partitioning column and clustering column.;Use the bq query --maximum_bytes_billed flag to restrict the number of bytes billed.;;;Recreate the table with a partitioning column and clustering column.;In Google BigQuery, you can use partitioning and clustering to optimize the performance of your queries, as well as to control costs. Partitioning allows BigQuery to scan less data when you run queries, reducing costs and improving performance. Clustering reorganizes your data based on the contents of specific columns, which further improves query performance.
100;You have a requirement to insert minute-resolution data from 50,000 sensors into a BigQuery table. You expect significant growth in data volume and need the data to be available within 1 minute of ingestion for real-time analysis of aggregated trends. What should you do?;1;Use bq load to load a batch of sensor data every 60 seconds.;Use a Cloud Dataflow pipeline to stream data into the BigQuery table.;Use the INSERT statement to insert a batch of data every 60 seconds.;Use the MERGE statement to apply updates in batch every 60 seconds.;;;Use a Cloud Dataflow pipeline to stream data into the BigQuery table.;Cloud Dataflow is designed for processing both batch and real-time data streams, and it can support high-volume, high-velocity data. By using Cloud Dataflow, you can ensure that data will be available in BigQuery within 1 minute of ingestion, as it supports near real-time data processing.
101;You need to copy millions of sensitive patient records from a relational database to BigQuery. The total size of the database is 10 TB. You need to design a solution that is secure and time-efficient. What should you do?;1;Export the records from the database as an Avro file. Upload the file to GCS using gsutil, and then load the Avro file into BigQuery using the BigQuery web UI in the GCP Console.;Export the records from the database as an Avro file. Copy the file onto a Transfer Appliance and send it to Google, and then load the Avro file into BigQuery using the BigQuery web UI in the GCP Console.;Export the records from the database into a CSV file. Create a public URL for the CSV file, and then use Storage Transfer Service to move the file to Cloud Storage. Load the CSV file into BigQuery using the BigQuery web UI in the GCP Console.;Export the records from the database as an Avro file. Create a public URL for the Avro file, and then use Storage Transfer Service to move the file to Cloud Storage. Load the Avro file into BigQuery using the BigQuery web UI in the GCP Console.;;;Export the records from the database as an Avro file. Copy the file onto a Transfer Appliance and send it to Google, and then load the Avro file into BigQuery using the BigQuery web UI in the GCP Console.;Given the size of the database and the sensitive nature of the data, using the Google Transfer Appliance is the most secure and time-efficient method. The Transfer Appliance is a hardware appliance that you can use to securely and efficiently transfer large volumes of data (from hundreds of terabytes up to 1 petabyte) to Google Cloud. Once the data is in Google Cloud, it can be easily imported into BigQuery.
102;You need to create a near real-time inventory dashboard that reads the main inventory tables in your BigQuery data warehouse. Historical inventory data is stored as inventory balances by item and location. You have several thousand updates to inventory every hour. You want to maximize performance of the dashboard and ensure that the data is accurate. What should you do?;1;Leverage BigQuery UPDATE statements to update the inventory balances as they are changing.;Partition the inventory balance table by item to reduce the amount of data scanned with each inventory update.;Use the BigQuery streaming to stream changes into a daily inventory movement table. Calculate balances in a view that joins it to the historical inventory balance table. Update the inventory balance table nightly.;Use the BigQuery bulk loader to batch load inventory changes into a daily inventory movement table. Calculate balances in a view that joins it to the historical inventory balance table. Update the inventory balance table nightly.;;;Use the BigQuery streaming to stream changes into a daily inventory movement table. Calculate balances in a view that joins it to the historical inventory balance table. Update the inventory balance table nightly.;Streaming data into BigQuery is best for near real-time needs as it allows you to ingest and analyze data concurrently. By streaming changes into a daily inventory movement table and calculating balances in a view, you are reducing the latency between when data is ingested and when it becomes available for querying. Updating the inventory balance table nightly allows you to keep your historical data up to date without impacting the performance of your real-time dashboard.
103;You have a data stored in BigQuery. The data in the BigQuery dataset must be highly available. You need to define a storage, backup, and recovery strategy of this data that minimizes cost. How should you configure the BigQuery table that have a recovery point objective (RPO) of 30 days?;1;Set the BigQuery dataset to be regional. In the event of an emergency, use a point-in-time snapshot to recover the data.;Set the BigQuery dataset to be regional. Create a scheduled query to make copies of the data to tables suffixed with the time of the backup. In the event of an emergency, use the backup copy of the table.;Set the BigQuery dataset to be multi-regional. In the event of an emergency, use a point-in-time snapshot to recover the data.;Set the BigQuery dataset to be multi-regional. Create a scheduled query to make copies of the data to tables suffixed with the time of the backup. In the event of an emergency, use the backup copy of the table.;;;Set the BigQuery dataset to be multi-regional. In the event of an emergency, use a point-in-time snapshot to recover the data.;https://cloud.google.com/bigquery/docs/table-snapshots-intro#table_snapshots<BR> A BigQuery table snapshot preserves the contents of a table (called the base table) at a particular time. You can save a snapshot of a current table, or create a snapshot of a table as it was at any time in the past seven days. A table snapshot can have an expiration, when the configured amount of time has passed since the table snapshot was created, BigQuery deletes the table snapshot. You can query a table snapshot as you would a standard table. Table snapshots are read-only, but you can create (restore) a standard table from a table snapshot, and then you can modify the restored table.
