Question_number;Question;NumCorrect;Answer1;Answer2;Answer3;Answer4;Answer5;Answer6;Correct;Explanation
137;You have a data pipeline with a Dataflow job that aggregates and writes time series metrics to Bigtable. You notice that data is slow to update in Bigtable. This data feeds a dashboard used by thousands of users across the organization. You need to support additional concurrent users and reduce the amount of time required to write the data. Which two actions should you take?;2;Configure your Dataflow pipeline to use local execution;Increase the maximum number of Dataflow workers by setting maxNumWorkers in PipelineOptions;Increase the number of nodes in the Bigtable cluster;Modify your Dataflow pipeline to use the Flatten transform before writing to Bigtable;Modify your Dataflow pipeline to use the CoGroupByKey transform before writing to Bigtable;;Increase the maximum number of Dataflow workers by setting maxNumWorkers in PipelineOptions, Increase the number of nodes in the Bigtable cluster|Increase the number of nodes in the Bigtable cluster;Increasing the maximum number of Dataflow workers can help scale out processing capacity. This allows Google Cloud Dataflow to use more resources when the demand increases, which can improve the overall throughput and efficiency of the pipeline. Increasing the number of nodes in the Bigtable cluster can help increase the read and write capacity. This can help reduce the time required to write data, which will be beneficial in this situation where the update in Bigtable is slow. Option A, configuring your Dataflow pipeline to use local execution, wouldn't help here. Local execution is typically used for development and testing, not for improving performance in a production environment. Options D and E, modifying your Dataflow pipeline to use the Flatten transform or the CoGroupByKey transform before writing to Bigtable, would not necessarily improve performance. The choice of transform depends on the specifics of the data processing logic, and neither of these transforms is specifically designed to improve writing performance to Bigtable.
138;You have several Spark jobs that run on a Cloud Dataproc cluster on a schedule. Some of the jobs run in sequence, and some of the jobs run concurrently. You need to automate this process. What should you do?;1;Create a Cloud Dataproc Workflow Template;Create an initialization action to execute the jobs;Create a Directed Acyclic Graph in Cloud Composer;Create a Bash script that uses the Cloud SDK to create a cluster, execute jobs, and then tear down the cluster;;;Create a Directed Acyclic Graph in Cloud Composer;Cloud Composer is a fully managed workflow orchestration service that empowers you to author, schedule, and monitor pipelines that span across clouds and on-premises data centers. Cloud Composer is built on Apache Airflow, an open-source project focused on workflows. You can create a Directed Acyclic Graph (DAG) in Cloud Composer to automate the process, handle dependencies, and manage the order of the jobs. Cloud Dataproc Workflow Templates are used to automate job and cluster creation, but they are not designed to handle complex scenarios where some jobs run in sequence, and some run concurrently. An initialization action runs when a Dataproc cluster is created. This would not help in automating a complex job sequence or scheduling. A Bash script could work, but this would require a lot of manual work and may not be easily maintainable. It doesn't offer the robust features of a workflow orchestration tool like Cloud Composer.
139;You are building a new data pipeline to share data between two different types of applications:<br> jobs generators and job runners. Your solution must scale to accommodate increases in usage and must accommodate the addition of new applications without negatively affecting the performance of existing ones. What should you do?;1;Create an API using App Engine to receive and send messages to the applications;Use a Cloud Pub/Sub topic to publish jobs, and use subscriptions to execute them;Create a table on Cloud SQL, and insert and delete rows with the job information;Create a table on Cloud Spanner, and insert and delete rows with the job information;;;Use a Cloud Pub/Sub topic to publish jobs, and use subscriptions to execute them;Cloud Pub/Sub provides a highly scalable, flexible, and reliable messaging system that decouples senders and receivers. It's a great solution for data pipelines that require high-throughput and low-latency processing, and it offers at-least-once message delivery. In this scenario, job generators could publish jobs to a Pub/Sub topic, and job runners could subscribe to this topic to execute the jobs. Option A might not scale as efficiently as Cloud Pub/Sub, especially under a high load of messages. Besides, it could introduce additional latency, as all messages would need to be processed by the App Engine service. Option C and D, using Cloud SQL or Cloud Spanner as a messaging queue is not a good idea. These are relational databases designed for structured data storage, not for messaging. Also, they might not be able to scale horizontally as efficiently as Cloud Pub/Sub can, which could negatively affect the performance of the system under high loads.
140;You need to create a new transaction table in Cloud Spanner that stores product sales data. You are deciding what to use as a primary key. From a performance perspective, which strategy should you choose?;1;The current epoch time;A concatenation of the product name and the current epoch time;A random universally unique identifier number (version 4 UUID);The original order identification number from the sales system, which is a monotonically increasing integer;;;A random universally unique identifier number (version 4 UUID);Cloud Spanner distributes user data across multiple servers according to the lexicographic order of the key. If you use monotonically increasing or decreasing values like epoch time or order IDs as the key (Options A and D), it can lead to 'hotspotting,' where a disproportionate amount of workload is directed at a small number of servers. This can seriously harm the performance of a Cloud Spanner database. Random UUIDs (Option C) do a much better job of distributing data evenly across servers, which leads to better performance. Using the product name concatenated with the current epoch time (Option B) could also lead to hotspotting, especially if a small number of products are sold frequently. It's generally not recommended to use keys that could be unevenly distributed or predictable.
141;Data Analysts in your company have the Cloud IAM Owner role assigned to them in their projects to allow them to work with multiple GCP products in their projects. Your organization requires that all BigQuery data access logs be retained for 6 months. You need to ensure that only audit personnel in your company can access the data access logs for all projects. What should you do?;1;Enable data access logs in each Data Analyst's project. Restrict access to Stackdriver Logging via Cloud IAM roles.;Export the data access logs via a project-level export sink to a Cloud Storage bucket in the Data Analysts' projects. Restrict access to the Cloud Storage bucket.;Export the data access logs via a project-level export sink to a Cloud Storage bucket in a newly created projects for audit logs. Restrict access to the project with the exported logs.;Export the data access logs via an aggregated export sink to a Cloud Storage bucket in a newly created project for audit logs. Restrict access to the project that contains the exported logs.;;;Export the data access logs via an aggregated export sink to a Cloud Storage bucket in a newly created project for audit logs. Restrict access to the project that contains the exported logs.;You want to aggregate logs from all projects into one project and then restrict access to only those who need to see the logs. This can be accomplished by using an aggregated export sink, which will capture logs from all the projects in the organization and export them to a specified destination, in this case, a Cloud Storage bucket in a new project. Then, by using Cloud IAM, you can restrict access to the project containing the logs so only audit personnel can view them. This solution provides a centralized, secure location for all logs while ensuring that only authorized personnel have access. Note: Stackdriver Logging has been renamed to Cloud Logging.
142;Each analytics team in your organization is running BigQuery jobs in their own projects. You want to enable each team to monitor slot usage within their projects. What should you do?;1;Create a Cloud Monitoring dashboard based on the BigQuery metric query/scanned_bytes;Create a Cloud Monitoring dashboard based on the BigQuery metric slots/allocated_for_project;Create a log export for each project, capture the BigQuery job execution logs, create a custom metric based on the totalSlotMs, and create a Cloud Monitoring dashboard based on the custom metric;Create an aggregated log export at the organization level, capture the BigQuery job execution logs, create a custom metric based on the totalSlotMs, and create a Cloud Monitoring dashboard based on the custom metric;;;Create a Cloud Monitoring dashboard based on the BigQuery metric slots/allocated_for_project;Cloud Monitoring provides visibility into the performance, uptime, and overall health of cloud-powered applications. Google Clouds operations suite (formerly Stackdriver) aggregates metrics, logs, and events from infrastructure, giving developers and operators a rich set of observable signals that speed root-cause analysis and reduce mean time to resolution (MTTR). BigQuery has built-in metrics such as slots/allocated_for_project, which shows the average number of slots allocated during a time interval, available in Cloud Monitoring. By creating a Cloud Monitoring dashboard based on this metric, each team can monitor their slot usage within their projects.
143;You are operating a streaming Cloud Dataflow pipeline. Your engineers have a new version of the pipeline with a different windowing algorithm and triggering strategy. You want to update the running pipeline with the new version. You want to ensure that no data is lost during the update. What should you do?;1;Update the Cloud Dataflow pipeline inflight by passing the --update option with the --jobName set to the existing job name;Update the Cloud Dataflow pipeline inflight by passing the --update option with the --jobName set to a new unique job name;Stop the Cloud Dataflow pipeline with the Cancel option. Create a new Cloud Dataflow job with the updated code;Stop the Cloud Dataflow pipeline with the Drain option. Create a new Cloud Dataflow job with the updated code;;;Stop the Cloud Dataflow pipeline with the Drain option. Create a new Cloud Dataflow job with the updated code;Updating a Cloud Dataflow pipeline in-place (options A and B) is possible, but it's not suitable for all changes, especially changes to the windowing and triggering strategy, because they can significantly change the pipeline's structure. Stopping a pipeline with the Cancel option (option C) will immediately halt the pipeline, potentially losing any data that's currently being processed. Draining a pipeline, on the other hand, ensures that the pipeline finishes processing all data as of the point when the drain was requested. Once drained, you can deploy the new version of the pipeline without the risk of data loss. Hence, option D is the right choice.
144;You need to move 2 PB of historical data from an on-premises storage appliance to Cloud Storage within six months, and your outbound network capacity is constrained to 20 Mb/sec. How should you migrate this data to Cloud Storage?;1;Use Transfer Appliance to copy the data to Cloud Storage;"Use gsutil cp ""J to compress the content being uploaded to Cloud Storage";Create a private URL for the historical data, and then use Storage Transfer Service to copy the data to Cloud Storage;Use trickle or ionice along with gsutil cp to limit the amount of bandwidth gsutil utilizes to less than 20 Mb/sec so it does not interfere with the production traffic;;;Use Transfer Appliance to copy the data to Cloud Storage;Given the amount of data (2 PB), the time constraint (six months), and the limited network bandwidth (20 Mb/sec), using a network-based solution for data transfer is not feasible. The Google Cloud Transfer Appliance, a hardware device that you install in your data center, is designed for such scenarios. You can load your data onto the appliance and then ship it to a Google upload facility, where the data is uploaded to Cloud Storage.
145;You receive data files in CSV format monthly from a third party. You need to cleanse this data, but every third month the schema of the files changes. Your requirements for implementing these transformations include:<br>-Executing the transformations on a schedule<br>- Enabling non-developer analysts to modify transformations<br> -Providing a graphical tool for designing transformations <br>What should you do?;1;Use Dataprep by Trifacta to build and maintain the transformation recipes, and execute them on a scheduled basis;Load each month's CSV data into BigQuery, and write a SQL query to transform the data to a standard schema. Merge the transformed tables together with a SQL query;Help the analysts write a Dataflow pipeline in Python to perform the transformation. The Python code should be stored in a revision control system and modified as the incoming data's schema changes;Use Apache Spark on Dataproc to infer the schema of the CSV file before creating a Dataframe. Then implement the transformations in Spark SQL before writing the data out to Cloud Storage and loading into BigQuery;;;Use Dataprep by Trifacta to build and maintain the transformation recipes, and execute them on a scheduled basis;Dataprep by Trifacta is a visual tool designed to explore and transform raw data from various sources. It is user-friendly and does not require coding skills, making it ideal for non-developer analysts. It also allows for building and maintaining transformation recipes, which can be executed on a schedule.
146;You want to migrate an on-premises Hadoop system to Cloud Dataproc. Hive is the primary tool in use, and the data format is Optimized Row Columnar (ORC). All ORC files have been successfully copied to a Cloud Storage bucket. You need to replicate some data to the cluster's local Hadoop Distributed File System (HDFS) to maximize performance. What are two ways to start using Hive in Cloud Dataproc? (Choose two.);2;Run the gsutil utility to transfer all ORC files from the Cloud Storage bucket to HDFS. Mount the Hive tables locally.;Run the gsutil utility to transfer all ORC files from the Cloud Storage bucket to any node of the Dataproc cluster. Mount the Hive tables locally.;Run the gsutil utility to transfer all ORC files from the Cloud Storage bucket to the master node of the Dataproc cluster. Then run the Hadoop utility to copy them do HDFS. Mount the Hive tables from HDFS.;Leverage Cloud Storage connector for Hadoop to mount the ORC files as external Hive tables. Replicate external Hive tables to the native ones.;Load the ORC files into BigQuery. Leverage BigQuery connector for Hadoop to mount the BigQuery tables as external Hive tables. Replicate external Hive tables to the native ones.;;Run the gsutil utility to transfer all ORC files from the Cloud Storage bucket to HDFS. Mount the Hive tables locally.|Leverage Cloud Storage connector for Hadoop to mount the ORC files as external Hive tables. Replicate external Hive tables to the native ones.;You can use the gsutil command-line tool to transfer your ORC files from Cloud Storage to HDFS. Then you can mount the Hive tables locally for querying with Hive on your Cloud Dataproc cluster. The Google Cloud Storage connector for Hadoop enables the Hadoop application to use Google Cloud Storage as an input/output source. By leveraging it, you can mount the ORC files stored in Google Cloud Storage as external Hive tables. Then you can create native Hive tables based on the external ones.
147;You are implementing several batch jobs that must be executed on a schedule. These jobs have many interdependent steps that must be executed in a specific order. Portions of the jobs involve executing shell scripts, running Hadoop jobs, and running queries in BigQuery. The jobs are expected to run for many minutes up to several hours. If the steps fail, they must be retried a fixed number of times. Which service should you use to manage the execution of these jobs?;1;Cloud Scheduler;Cloud Dataflow;Cloud Functions;Cloud Composer;;;Cloud Composer;Cloud Composer, which is a managed Apache Airflow service, is designed to create, schedule, monitor and manage workflows, making it an ideal choice for the described scenario. With Cloud Composer, you can manage complex workflows and dependencies with built-in retry and failure handling mechanisms.
148;You work for a shipping company that has distribution centers where packages move on delivery lines to route them properly. The company wants to add cameras to the delivery lines to detect and track any visual damage to the packages in transit. You need to create a way to automate the detection of damaged packages and flag them for human review in real time while the packages are in transit. Which solution should you choose?;1;Use BigQuery machine learning to be able to train the model at scale, so you can analyze the packages in batches.;Train an AutoML model on your corpus of images, and build an API around that model to integrate with the package tracking applications.;Use the Cloud Vision API to detect for damage, and raise an alert through Cloud Functions. Integrate the package tracking applications with this function.;Use TensorFlow to create a model that is trained on your corpus of images. Create a Python notebook in Cloud Datalab that uses this model so you can analyze for damaged packages.;;;Train an AutoML model on your corpus of images, and build an API around that model to integrate with the package tracking applications.;AutoML Vision is a powerful tool from Google Cloud that uses machine learning models to analyze images and provide predictions. It allows you to train a custom model using your own images, making it a great fit for this use case where you have a very specific task of detecting damage on packages in images. IM NOT SUREEEEE
149;You are migrating your data warehouse to BigQuery. You have migrated all of your data into tables in a dataset. Multiple users from your organization will be using the data. They should only see certain tables based on their team membership. How should you set user permissions?;1;A. Assign the users/groups data viewer access at the table level for each table;B. Create SQL views for each team in the same dataset in which the data resides, and assign the users/groups data viewer access to the SQL views;C. Create authorized views for each team in the same dataset in which the data resides, and assign the users/groups data viewer access to the authorized views;D. Create authorized views for each team in datasets created for each team. Assign the authorized views data viewer access to the dataset in which the data resides. Assign the users/groups data viewer access to the datasets in which the authorized views reside;;;A. Assign the users/groups data viewer access at the table level for each table;
150;You want to build a managed Hadoop system as your data lake. The data transformation process is composed of a series of Hadoop jobs executed in sequence. To accomplish the design of separating storage from compute, you decided to use the Cloud Storage connector to store all input data, output data, and intermediary data. However, you noticed that one Hadoop job runs very slowly with Cloud Dataproc, when compared with the on-premises bare-metal Hadoop environment (8-core nodes with 100-GB RAM). Analysis shows that this particular Hadoop job is disk I/O intensive. You want to resolve the issue. What should you do?;1;Allocate sufficient memory to the Hadoop cluster, so that the intermediary data of that particular Hadoop job can be held in memory;Allocate sufficient persistent disk space to the Hadoop cluster, and store the intermediate data of that particular Hadoop job on native HDFS;Allocate more CPU cores of the virtual machine instances of the Hadoop cluster so that the networking bandwidth for each instance can scale up;Allocate additional network interface card (NIC), and configure link aggregation in the operating system to use the combined throughput when working with Cloud Storage;;;Allocate sufficient persistent disk space to the Hadoop cluster, and store the intermediate data of that particular Hadoop job on native HDFS;If a particular Hadoop job is disk I/O intensive, storing intermediate data in Cloud Storage may not be optimal because of the network latency involved in accessing Cloud Storage. Instead, storing the intermediate data on local HDFS (Hadoop Distributed File System) on the Dataproc nodes could lead to faster data access, thereby improving the performance of the Hadoop job.
151;You work for an advertising company, and you've developed a Spark ML model to predict click-through rates at advertisement blocks. You've been developing everything at your on-premises data center, and now your company is migrating to Google Cloud. Your data center will be closing soon, so a rapid lift-and-shift migration is necessary. However, the data you've been using will be migrated to migrated to BigQuery. You periodically retrain your Spark ML models, so you need to migrate existing training pipelines to Google Cloud. What should you do?;1;Use Vertex AI for training existing Spark ML models;Rewrite your models on TensorFlow, and start using Vertex AI;Use Dataproc for training existing Spark ML models, but start reading data directly from BigQuery;Spin up a Spark cluster on Compute Engine, and train Spark ML models on the data exported from BigQuery;;;Use Dataproc for training existing Spark ML models, but start reading data directly from BigQuery;Google Cloud Dataproc is a managed Spark and Hadoop service that lets you run your existing Spark ML jobs on Google Cloud by migrating your data to BigQuery and adjusting your jobs to read data from BigQuery MAKE SHURE IS JUST GPT ANSWER
152;You work for a global shipping company. You want to train a model on 40 TB of data to predict which ships in each geographic region are likely to cause delivery delays on any given day. The model will be based on multiple attributes collected from multiple sources. Telemetry data, including location in GeoJSON format, will be pulled from each ship and loaded every hour. You want to have a dashboard that shows how many and which ships are likely to cause delays within a region. You want to use a storage solution that has native functionality for prediction and geospatial processing. Which storage solution should you use?;1;BigQuery;Cloud Bigtable;Cloud Datastore;Cloud SQL for PostgreSQL;;;BigQuery;Google BigQuery is a fully-managed, serverless data warehouse that enables super-fast SQL queries using the processing power of Google's infrastructure. It has native support for GeoJSON and geospatial processing. MAKE SHURE IS JUST GPT ANSWER
153;You operate an IoT pipeline built around Apache Kafka that normally receives around 5000 messages per second. You want to use Google Cloud Platform to create an alert as soon as the moving average over 1 hour drops below 4000 messages per second. What should you do?;1;Consume the stream of data in Dataflow using Kafka IO. Set a sliding time window of 1 hour every 5 minutes. Compute the average when the window closes, and send an alert if the average is less than 4000 messages.;Consume the stream of data in Dataflow using Kafka IO. Set a fixed time window of 1 hour. Compute the average when the window closes, and send an alert if the average is less than 4000 messages.;Use Kafka Connect to link your Kafka message queue to Pub/Sub. Use a Dataflow template to write your messages from Pub/Sub to Bigtable. Use Cloud Scheduler to run a script every hour that counts the number of rows created in Bigtable in the last hour. If that number falls below 4000, send an alert.;Use Kafka Connect to link your Kafka message queue to Pub/Sub. Use a Dataflow template to write your messages from Pub/Sub to BigQuery. Use Cloud Scheduler to run a script every five minutes that counts the number of rows created in BigQuery in the last hour. If that number falls below 4000, send an alert.;;;Consume the stream of data in Dataflow using Kafka IO. Set a sliding time window of 1 hour every 5 minutes. Compute the average when the window closes, and send an alert if the average is less than 4000 messages.;This solution leverages Google Cloud's Dataflow service, which is designed for exactly this type of real-time, window-based stream processing. MAKE SHURE IS JUST GPT ANSWER
